field_name,form_name,section_header,field_type,field_label,select_choices_or_calculations,field_note,text_validation_type_or_show_slider_number,text_validation_min,text_validation_max,identifier,branching_logic,required_field,custom_alignment,question_number,matrix_group_name,matrix_ranking,field_annotation
cm_cmoccur,conmeds,,radio,"Did the subject take any concomitant medications during treatment?","N, NO | Y, YES",,,,,,,y,,,,,
cm_suppcm_cmprtrt,conmeds,,radio,"Was this subject taking this medication at OR prior to baseline?","N, NO | Y, YES",,,,,,"[cm_cmoccur] = 'Y'",y,,,,,
cm_cmstdtc,conmeds,,text,"ConMed start date",,"YYYY-MM-DD ",date_ymd,,,,"[cm_cmoccur] = 'Y' and [cm_suppcm_cmprtrt] = 'N'",y,,,,,
cm_cmtrt,conmeds,,text,Medication,BIOPORTAL:RXNORM,"Enter RXNORM description or code",,,,,"[cm_cmoccur] = 'Y'",y,,,,,
cm_cmindc,conmeds,,text,Indication,BIOPORTAL:MEDDRA,"Enter MEDDRA Low Level Term",,,,,"[cm_cmoccur] = 'Y'",y,,,,,
cm_suppcm_exacindc,conmeds,,radio,"Exacerbation of previous indication?","N, NO | Y, YES",,,,,,"[cm_cmoccur] = 'Y'",y,,,,,
cm_suppcm_prphindc,conmeds,,radio,"Prophylaxis for this indication?","N, NO | Y, YES",,,,,,"[cm_cmoccur] = 'Y'",y,,,,,
